"Post Title";"Post URL";"Content";"Post Score";"Post Date"
"NYSE:ADT is preparing to run wild.";"https://www.reddit.com/r/wallstreetbets/comments/1b9scno/nyseadt_is_preparing_to_run_wild/";"I was eating a big bowl of Strawberry Milkshake Frosted Flakes this morning when I stumbled across this:  [ADT can't keep ahold of money or stock confidence over the last few years](https://finance.yahoo.com/news/adt-nyse-adt-shareholders-endured-131901817.html). The graph looks like me with red crayons, boring as hell. Can't discern anything of value.  But we're moving to a new house, wife wanted to get ADT again, but we had a Nest Secure in the past so I wanted to stick with that. I start digging through the news and scraped this timeline together, and think I found a banger.  [In 2000, Google bought 6.6~~6~~% of ADT](https://www.cnbc.com/2020/08/03/google-to-invest-450-million-to-acquire-a-6point6percent-stake-in-adt.html) and then [immediately and quietly discontinued Nest Secure](https://www.techradar.com/news/google-discontinues-nest-secure-here-are-the-best-security-system-alternatives) only 2 months later. Google offered $200 or a crappppppy current ADT setup/service valued at $465. Reddit and everywhere online, including Nest's own user troubleshooting website, is full of people that are MAD.  [Then someone at Verge found this in October 2023](https://www.theverge.com/2023/10/13/23915644/adt-google-security-system-nest-secure-leak), which is basically Nest's system rebranded as ADT. End of January 2024, more fuel added to the fire when [they found some youtube videos of the new system](https://www.theverge.com/2024/1/23/24048187/adt-smart-home-security-system-google-nest-launch).  Today, I got a notification [that they're going ex-dividend shortly.](https://finance.yahoo.com/news/adt-inc-nyse-adt-stock-115149765.html)  With the Nest Secure end of support/operation being April 8th, it's safe to say that sometime between March 13th and April 8th Google and/or ADT are going to announce their rebranded Nest hardware is being sold by ADT, and if you buy ADT stock on or before March 12th, you'll get the dividend of supporting them (which is likely gonna be Google's return on that 6% investment).  Supposedly the break between 2020 and 2024 is because they made a deal with another security company to resell services, so they had to support any new installs for a minimum of 3 years. Now that all of those contracts are completed, Google and ADT will likely try to dominate the market again with another product they'll abandon in 2-3 years. Eff you Google for discontinuing Stadia.  I have zero money in this stock sadly, all of the monies are tied up in -stock-not-allowed-to-mention-here- and my new house. Regard~~less~~, this stock was something that I haven't seen on here yet, so I wanted to share.";"0";"2024-03-08T17:32:21"
"$ADBE earnings coming after hours but their generative AI is already DOA. Good luck";"https://www.reddit.com/r/wallstreetbets/comments/1bejs2b/adbe_earnings_coming_after_hours_but_their/";"[https://www.dailymail.co.uk/news/article-13194153/Adobe-firefly-AI-google-gemini-black-nazis-vikings.html](https://www.dailymail.co.uk/news/article-13194153/Adobe-firefly-AI-google-gemini-black-nazis-vikings.html)  &#x200B:  https://preview.redd.it/8rklzcc4kaoc1.png?width=436&format=png&auto=webp&s=75f5914c0b364755cd9a52d9c8a048bdc1572e5b";"0";"2024-03-14T13:15:28"
"Daily Discussion Thread for December 06, 2023";"https://www.reddit.com/r/wallstreetbets/comments/18c1jq8/daily_discussion_thread_for_december_06_2023/";"Join [WSB's community voice chat](https://discord.com/channels/1037784194476163223/1083096862099263528), every day from 8:30am to whenever!  Check out our [Earnings Thread](https://reddit.com/r/wallstreetbets/about/sticky?num=2) and [Rules](https://www.reddit.com/r/wallstreetbets/wiki/contentguide).";"76";"2023-12-06T12:00:54"
"If you missed the NVDA train, buy ARM";"https://www.reddit.com/r/wallstreetbets/comments/1b8499a/if_you_missed_the_nvda_train_buy_arm/";"Summary: I fully expect Nvidia and Jensen Huang to go after ARM and acquire a (rather large) stake at any moment, possibly as soon as lockup expires next week. If Trump wins election and FTC changes leadership, Nvidia will likely try to acquire ARM outright.   Background: In late September 2020, [Nvidia announced plans to acquire ARM from Softbank](https://nvidianews.nvidia.com/news/nvidia-to-acquire-arm-for-40-billion-creating-worlds-premier-computing-company-for-the-age-of-ai) for $40 billion. At that time, NVDA was \~ $400 billion company, 10x the value of ARM. In December 2021, the [FTC sues to block the merger](https://www.ftc.gov/news-events/news/press-releases/2021/12/ftc-sues-block-40-billion-semiconductor-chip-merger) citing anti-competitive advantages the combined firm would do in the AI race. On February 2022, Nvidia and Softbank announce [the termination of Nvidia acquitition of ARM Holdings](https://nvidianews.nvidia.com/news/nvidia-and-softbank-group-announce-termination-of-nvidias-acquisition-of-arm-limited) and Softbank immediately announced plans to IPO ARM. ARM would IPO in September of 2023.   All the major tech companies in the world (Microsoft, Google, Apple, Samsung, Qualcomm, Broadcom, AMD, META, Tesla, and many many others) are working to design their own chips, most are based on [ARM architecture](https://www.cnbc.com/video/2023/11/09/how-arm-gained-chip-dominance-with-apple-nvidia-amazon-and-qualcomm.html) and Jensen Huang sees the writing on the wall. Jensen also knows that his main competitors, including some of the big boys, are also champing at the bit to either get their own stake or prevent Nvidia from cornering the entire market outright. It's a race against the inevitable.   If Nvidia was successful in acquiring ARM back in 2021, those $40 billion NVDA shares would be worth $220 billion to Softbank today if we go by the 10x valuation metric that both Nvidia and Softbank likely agreed upon back in 2020.   TL:DR: Missed NVDA run, buy ARM shares or leaps. Not investment advice!  &#x200B:";"1194";"2024-03-06T17:37:49"
"What Are Your Moves Tomorrow, October 24, 2023";"https://www.reddit.com/r/wallstreetbets/comments/17etjph/what_are_your_moves_tomorrow_october_24_2023/";"**Join **[**WSB's community voice chat**](https://discord.com/channels/1037784194476163223/1083096862099263528)**, every day from 8:30am to whenever!**  Check out our [Earnings Thread](https://reddit.com/r/wallstreetbets/s/YLr1wRKkq8) and [Rules](https://www.reddit.com/r/wallstreetbets/wiki/contentguide). DM the [mod inbox](https://www.reddit.com/message/compose/?to=/r/wallstreetbets)";"115";"2023-10-23T22:00:53"
"When are the benefits of AI coming to life to consumers?";"https://www.reddit.com/r/wallstreetbets/comments/18exhpj/when_are_the_benefits_of_ai_coming_to_life_to/";"With the pace with which AI is accelerating and the whole of S&P being pumped for the entire 2023, what actual monetization value did AI provide to companies up until now?  Sure you have models with billions of parameters. But how are companies going to monetize it? Who will be the end user for these AI models? I feel like 99% of the population doesn't care about any of this and is very hesitant to change any of their habits. Example being iphone vs Android - maybe android has lots of new shiny features which the iphone doesn't but who cares. Majority of ppl are not ready to adopt android as the daily phones. Another example being Google vs chatgpt - yes chatgpt might be the new shiny thing which can answer your questions but since the popularity of internet google has been the go to tool for ppl. I think apple is playing this smartly by not heavily investing in something which isn't proven to significantly increase their revenue.  Question is, if the end consumer is not ready to change their habits how will the new AI tech which is being touted as the next big thing be transformative? Is this all hype and how can we justify so much pump for these companies if their profit margins don't increase?";"10";"2023-12-10T07:37:56"
"$GOOG";"https://www.reddit.com/r/wallstreetbets/comments/14wacfr/goog/";"what do y’all think about googles upcoming week or 2. it’s split right down the middle in media with a lot of general people expecting a short down to $108, but there’s also a lot of people buying major amounts google calls. it fell under the 50 day line today which is definitely bearish, HOWEVER, last time it went below the line was the start of this bull run. It is also flattened on top of the volume-weighted average still and was bought in huge volumes in todays after hours. im personally bullish on google at the moment but i wanna know what you all think, will googles rally continue or will there be a short this coming week?";"18";"2023-07-11T01:40:26"
"It’s a bull trap fellas";"https://www.reddit.com/r/wallstreetbets/comments/1agtgz5/its_a_bull_trap_fellas/";"We're breaking all time highs in call options and have a high correlation between bonds and stocks.  Also note a giant capital outflow by institutional investors (meaning they're taking their chance to sell) and capital inflows by retail investors (i.e. dumb money).  Just gotta wait for the 'surprise' (or in reality combo of punches) that brings the pillow down on this glimmer of hope (and greed / insanity) in the market and chokes it out.   ""Whoops turns out we measured inflation wrong, it's higher than we thought for the previous 3 months!""  ""Whoops we measured job growth wrong! We actually lost jobs, forgot the negative sign wrong oopsies""  ""Whoops, gotta file bankruptcy for Bed Bath n Beyond, Hertz, and 40 other major companies! Oops!""  https://imgur.com/a/IX9CRFR";"286";"2024-02-02T03:57:25"
"I told my grandson I have 4000 NVDA shares so he'll wipe my ass";"https://www.reddit.com/r/wallstreetbets/comments/1awompn/i_told_my_grandson_i_have_4000_nvda_shares_so/";"TL:DR: my gullible grandson wipes my ass to get into my will because I told him I bought 4,000 $NVDA shares (1,000 shares pre 4:1 split) in 2018/2019 and am now sitting on >$2.5 million in NVDA.  I'm 87 and immobile in a wheelchair and don't know anything about semiconductors or anything else technology related. I cannot Google or text, and I currently have someone who lives in my home 24/7 and wipes my ass for me. However, I'm a damn intuitive savant when it comes to tricking gullible kids.  I did grow up in the biggest bull market in human history with some Boomers printing money like Chuck E. Cheese bucks.. and everyone is a genius in a bull market.. Well almost everyone. I didn't invest so now I just scam Millennials and Zoomers.  Anyway, I like talking stocks with my grandson because it’s something we could connect on, and I have a ton of experience selling worthless advice to idiots. So in 2018 we were talking about the market, and I casually brought up Nvidia. He thought I didn't guide him to that at all. He bought Nvidia in 2017 so he was familiar with it although he bought his shares at 18 yrs old with $2k he had saved up. Nothing insane although he kept 90% to this day. I said I saw NVIDIA in a newspaper article with someone recommending it for elderly’s retirement accounts. So I told my grandson I was an OGangster, called my broker and bought 1,000 shares on the spot because in my words: “I don’t buy a stock if I can’t afford 1,000 shares”. Something only the Zoomers dumb enough to buy meme stocks would fall for.   He was dumbstruck because here he thought he was doing great with his savings over the years, and I just humbled his ass with a completely made up sentence. Add in the 4:1 stock split, and now he thinks I'm sitting on 4,000 shares. (I ""confirmed"" it to him when he brought it up in the last month). I haven't sold a dime and don't even know what the price is doing day to day because I don't own any shares.  I'm just chilling in my wheelchair and letting him try to get a bigger share of the inheritance. He called and celebrated with me the other day because he transparently wants to get in my will. He thinks I'm already wealthy and dumb enough to drop 6 figures on a stock I know little about.  He hopes to inherit my wealth someday, but he’s also a scammy, golddigging SOB and he knows it! Told me “haha you're a genius investor and luck has nothing to do with”. Thought id share here because I’m not sharing this IRL, but I find it pretty ironic my dumb ass grandson is outwiping 95% of this sub. Wendy's boys included.";"21839";"2024-02-21T22:56:15"
"Using Gradient Decent to derive Stock Predictions from Option Prices [Possible Insider Trading Exposed?]";"https://www.reddit.com/r/wallstreetbets/comments/1b9aybj/using_gradient_decent_to_derive_stock_predictions/";"# THESE PREDICTIONS ARE ONLY AS ACCURATE AS THE OPTIONS THAT EXIST  # Lines go [95%, 65%, Average, 65%, 95%] in terms of confidence intervals. I.E. the stock has a 65% chance of remaining within two dark lines, and a 95% chance of remaining within the grey two lines.  I can not show you the code or the programs used to generate this data, I can only describe what was done to find this data. Using the option prices I was able to extract what the market believes the possible future prices of different stocks are.  TLDR: I have access (as a developer of the software) of an algorithm that tells you what options are prices based off of, and theres something you should take a look at.  Look at these graphs and tell me if you notice something odd...  https://preview.redd.it/bhfp8eu6r1nc1.png?width=989&format=png&auto=webp&s=757509d0ad2422498773134968bb8665cad733f9  https://preview.redd.it/6e5tv6nbr1nc1.png?width=989&format=png&auto=webp&s=c141fe42090e2b8740c445d36fc0c5cc13f8b2c4  The predictions for the google stock seem to take this large jump on \`2024-06-21\`. I have no idea what this is, perhaps some google exec thought they were slick by buying a bunch of options for after some product announcement. Anyways.  Based on this info, I'd be going in on some \`2024-07-19\` calls.  You could go for some \`2024-06-21\` calls but the option prices seem to be weird for that date.  Anyways, hope you find this stuff interesting. Ask me to run this on another stock and I'll do it.  Look at the large volume of google calls:  https://preview.redd.it/hnxbman4h0nc1.png?width=1560&format=png&auto=webp&s=342b301342f1b4e800aa908320b2001568719910  https://preview.redd.it/bro0tzb1h0nc1.png?width=1596&format=png&auto=webp&s=29522d0e55601e404a9eb1cf6e63ef5641c90e64";"12";"2024-03-08T02:12:27"
"$GOOG Releases Gemini as Answer to GPT 4 - Will this Shift the AI Race?";"https://www.reddit.com/r/wallstreetbets/comments/18c6w9z/goog_releases_gemini_as_answer_to_gpt_4_will_this/";"Update: Jimmy Apples dunks all over release alluding to OpenAI holding something major up their sleeve. Can $Goog ever catch up if this is as big as JA is making it?  Update: Ultra model - true GPT 4 competitor not released until next year.   [https://www.wired.com/story/google-gemini-ai-model-chatgpt/](https://www.wired.com/story/google-gemini-ai-model-chatgpt/)  This is huge. I don't think the market picked up on it as of yet.  &#x200B:";"20";"2023-12-06T16:50:55"
"Could QQQ be primed for a major upswing?";"https://www.reddit.com/r/wallstreetbets/comments/1b8c626/could_qqq_be_primed_for_a_major_upswing/";"Now I realize it’s $8.00 from ATH but some of its largest holdings Tesla, Google, Microsoft, Apple are at 3mo lows.   It’s not even a meme anymore, Nvidia is single handily holding up major index’s. Pretty scary NGL.   In my mind two things can happen….NVDA dumps and bottom drops on everything or NVDA stays between $800-900 and everyone else plays catch up. No way this divergence is sustainable.   Wild time to be alive.";"69";"2024-03-06T22:43:06"
"Weekend Discussion Thread for the Weekend of September 16, 2023";"https://www.reddit.com/r/wallstreetbets/comments/16jn7o3/weekend_discussion_thread_for_the_weekend_of/";"#Come hang with us on [Discord](https://discord.gg/wsbverse)  Check out last week's [Earnings Thread](https://www.reddit.com/r/wallstreetbets/comments/16dan5n/most_anticipated_earnings_releases_for_the_week/) and [Rules](https://www.reddit.com/r/wallstreetbets/wiki/contentguide). DM the [mod inbox](https://www.reddit.com/message/compose/?to=/r/wallstreetbets)";"93";"2023-09-15T22:00:21"
"Are we in a super bubble? An analysis of the magnificent 7";"https://www.reddit.com/r/wallstreetbets/comments/18lrfdp/are_we_in_a_super_bubble_an_analysis_of_the/";"So first we we recognize that 7 stocks are driving all growth. Nvidia Tesla Meta Microsoft Amazon Apple Google  And we can we can see these companies don't all things in common, but they have a few things.  Platform monopolies: Google, Microsoft, Apple, Amazon. These companies all have monopolies and no one cares and can continue to die wherever they want to print money  Risks:  Google lost their app store monopoly lawsuit   Amazon loses money to run an unprofitable retail business to get a monopoly. Everyone else has comparable offerings to AWS.  Meta and Google: these are social media plays. The easiest way to destroy America or influence it's politics is via Facebook, TikTok, and YouTube. Foreign governments and local politicians all dump money into these platforms to cause civil unrest and pollute minds.  Risks: Eventually America might actually fall and social media won't be useful anymore. Alternatively, America will topple the governments of the countries doing this, such as Russia and China. Low risk of either outcome.  Nvidia and Tesla. Enron style financial scams. These companies play financial shell games and provide lines of credit to shell companies and broke customers so they can buy their products on paper and manipulate their product prices upwards. Thankfully, Enron ran for almost a decade before it blew up and these companies have only a few years of shady finances, 5 at most for Telsa and less for Nvidia. They may blow up, but not today and not tomorrow.  Risks: the super profitable Enron schemes blow up sooner for Nvidia and Tesla than they did for Enron and we enter the second dotcom burst.  As we can see, all of the magnificent 7 are going to print money for the foreseeable future, at least another 5-10 years until a radical wins office and does major overalls of the systems that allow these companies to be super profitable.";"0";"2023-12-19T03:59:42"
"NVDA market cap is getting very close to AAPL";"https://www.reddit.com/r/wallstreetbets/comments/1bl2rsj/nvda_market_cap_is_getting_very_close_to_aapl/";"Total Cap for S&P 500: $46,694,388,906,496  Top 10 Total Cap: 34.38%  &#x200B:  |Ticker|Market Cap| |:-|:-| |MSFT|$3,172,612,177,920| |AAPL|$2,665,889,398,784| |NVDA|**$2,348,879,970,304**| |GOOGL|$1,880,253,661,184| |AMZN|$1,854,254,612,480| |META|$1,290,058,858,496| |BRK-A|$894,440,767,488| |LLY|$730,752,090,112| |AVGO|$632,328,683,520| |V|$584,670,511,104|  &#x200B:";"130";"2024-03-22T17:02:01"
