"Post Title";"Post URL";"Content";"Post Score";"Post Date"
"The Big Bet: Going Bullish on Google and Bearish on Microsoft";"https://www.reddit.com/r/wallstreetbets/comments/1b6jrtu/the_big_bet_going_bullish_on_google_and_bearish/";"Hey fellow degenerates,  I’m contemplating a bold move and would love to get your takes. I’m eyeing Google ($GOOGL) for a bullish play with Call options and Microsoft ($MSFT) for a bearish stance through Put options.  Here’s my rationale:  Google ($GOOGL) Calls: Despite recent flak over Gemini, their new but controversial LLM, I’m betting on Google’s comeback. The uproar was over Gemini producing some, let’s say, “creative” outputs (think: Pope imagery gone wild). Sergey Brin, Google’s co-founder, stepped out of his semi-retirement to steer the ship right, signaling a serious clean-up and commitment to excellence. Given Google’s unmatched data access (YouTube, Reddit data deals), I believe they’re uniquely positioned to refine and dominate the LLM space. This fiasco, while a setback, could be the wake-up call needed to spur significant positive changes, making Google a stronger contender in the AI race, especially against the backdrop of OpenAI and ChatGPT shaking up the traditional search model. “Why search when you can find?” - LLMs might just be the answer, and Google’s poised to capitalize on this paradigm shift.  Microsoft ($MSFT) Puts: On the flip side, I’m skeptical about Microsoft’s current trajectory. Copilot, their latest foray into AI, seems more gimmick than game-changer based on user feedback and practical utility. Beyond Teams and Copilot, I’m hard-pressed to find compelling innovations that could drive Microsoft’s value higher. The market’s enthusiasm for Microsoft, especially following its rally post-Nvidia, feels overblown. I suspect their AI offerings won’t be enough to sustain their recent growth, making them a prime candidate for a bearish bet.  So, I’m all in on Google thriving through its AI pivot and Microsoft facing headwinds with its AI initiatives. But, what do you think? Am I missing anything critical about Google’s prospects or overlooking potential upside in Microsoft’s strategy?  Change my mind or back me up, but either way, let’s hear those hot takes!";"23";"2024-03-04T20:29:15"
"$DXCM and Google";"https://www.reddit.com/r/wallstreetbets/comments/1bh2pvn/dxcm_and_google/";"Hey boys and ladies,     I bought into DexCom (200 shares at $136.80) after the company got their FDA approval for an over-the-counter continuous glucose monitor called Stelo. I thought this is a cool product that fitness geeks and diabetes people will all like. I would never use it, but it's cool if other people use it.  I noticed in some articles that Google is a big investor in DexCom. I checked Google's most recent 13F and the company is currently holding 3,681,885 shares at a value of $456,885,110. The shares held by Google have continuously increased over the past few months. Not a ton of money for Google, but I wonder what Google is doing with these holdings? I saw news that they partnered with them a while back for health apps and whatnot, but what other purpose is there?   One conspiracy theory that I thought of is that the USA is basically a population of pre-diabetic fat asses. Regular people will use this over-the-counter product and connect it to their Google account, then Google will have access to lots of people's actual blood glucose levels in real-time, which it could analyze to understand when people would be pissed and upset and have less overall tolerance for things when they have low-blood-sugar and feel better when they have higher blood sugar.  For instance, my wife and I just got into an argument about how she hates where we live and hates our children's school and wants to move to a new place. Turns out she was just hungry. Google can use this data for premium targeted ads that are timed for when you have low blood sugar (snickers, your not you when your hungry) or even sell this data to pharma companies that will convince you in a timely way that you suffer from anxiety or depression and that you need to be on medicine for the rest of your life to be normal but really you just needed to eat a banana.   The missing piece for me is what's in it for DexCom? Do they make any money on this?  My point here is that I'm thinking of putting more money into this company.  The recent dip makes me think bag holders got out on the gap up and now the stock is consolidating but the high PE makes me think I make a mistake. Throw in your 2 cents.";"13";"2024-03-17T18:08:57"
"Could reddit be bought by Google within a few years? ";"https://www.reddit.com/r/wallstreetbets/comments/1bq6hp1/could_reddit_be_bought_by_google_within_a_few/";"Makes sense they'd want a cheap social media company to unleash their AI on to interact with people on a large scale.  They can then perfect their product for a variety of purposes.  ";"0";"2024-03-28T21:57:09"
"GOOG (Alphabet / Google) - Cup and Handle?";"https://www.reddit.com/r/wallstreetbets/comments/1bzfvtp/goog_alphabet_google_cup_and_handle/";"&#x200B:  https://preview.redd.it/7x8mka7vxctc1.png?width=1987&format=png&auto=webp&s=cbcac11c6043e4bf1f7aa10dee450cf7a72de7ab  Any other regards betting on GOOG being on a breakout from cup and handle, or just me? I can add more crayon to the image if needed.   &#x200B:  I've had the stock for a while, maybe too long. But I just started building my long call position on Friday/Monday. Between potential cup and handle breakout and earnings coming up, I'm hoping it will run. Price target $175 for me. Lets see how well this ages.   &#x200B:  If it continues to rise tomorrow I'm gonna get another $1k to $3k in long calls. ";"14";"2024-04-09T03:36:26"
"Google King of AI - tendies update";"https://www.reddit.com/r/wallstreetbets/comments/1bi7wq7/google_king_of_ai_tendies_update/";"If you haven't read my DD [""Google: King of AI, end of woke""](https://www.reddit.com/r/wallstreetbets/comments/1bcmegt/google_dd_king_of_ai_the_end_of_woke/) \- then maybe you should  I didn't realize the tendies would come so soon but of course the GeminiPhone announcement certainly helped. Sorry not sorry to all the Goog haters.  https://preview.redd.it/54qmxarvx6pc1.png?width=1208&format=png&auto=webp&s=518d725751fec09b49be9e946c302b3a18c5790c  **This is just the beginning though**, one news story that the market is reacting to but only a first step of the overall trend until sentiment reverses. Google has the full AI package and share price has a ways to go to catch up to the AI hype names. I'm hodling.  Check out this screenshotted Reuters article echoing the King of AI thesis  [https://twitter.com/pennycheck/status/1769707761015615523](https://twitter.com/pennycheck/status/1769707761015615523)  The time to sell is when everyone agrees Goog is the King. Right now people are just excited about the AAPL deal. Enjoy the ride ya'll";"15";"2024-03-19T02:13:51"
"Implications of Google Buying HubSpot";"https://www.reddit.com/r/wallstreetbets/comments/1bwqki2/implications_of_google_buying_hubspot/";"**What Happened:** The second the internet found out that Alphabet, the parent company of Google, was in talks to make a bid for the marketing software company Hubspot…  Well… let's just say investors ran to purchase some shares.   **Background:** HubSpot, based in Cambridge, Massachusetts, had a market cap of around $32 billion before the news was leaked by [Reuters](https://www.msn.com/en-us/money/technology/hubspot-stock-jumps-amid-reports-google-parent-alphabet-considering-acquisition/ar-BB1l5hUX). The company provides businesses with marketing and customer service software.  **Company Synergies:** Many corporations track their SEO and Google Analytics data through HubSpot to see how well their site and the blogs or articles within it are performing over time, so the synergies are definitely present between the two companies.   **Potential Implications:** Alphabet must be careful as it has faced some major antitrust scrutiny over the past year.  * The U.S. Department of Justice recently filed its second antitrust suit against Google’s ad business. * The first antitrust lawsuit, filed in October 2020, accused Google of unlawfully obtaining a monopoly in the search market.  To make sure no antitrust issues come about this time around, Alphabet is making sure to consult with its financial partner, Morgan Stanley, first before making a potential offer.   Under the Biden administration, technology conglomerates have found it difficult to pursue mega deals that could cause unfair monopolistic competitive advantages in the industry.  **Bottom line:** If the acquisition were to go through, it would be the largest in Alphabets history and allow for its mega pile of cash to be put to use, currently at $110.9 billion as of the end of December[om here](https://www.blackswanstreet.com/subscribe)";"10";"2024-04-05T21:21:41"
"GOOGL Stock Down Today - OpenAI CEO announcement it's today";"https://www.reddit.com/r/wallstreetbets/comments/1cr13tx/googl_stock_down_today_openai_ceo_announcement/";"Thoughts on Sam Altman (OpenAI CEO) today's announcement?  GOOGL stock it's also down today, what's your move?";"15";"2024-05-13T16:45:54"
"Google offshores core positions: puts or calls?";"https://www.reddit.com/r/wallstreetbets/comments/1ciktu6/google_offshores_core_positions_puts_or_calls/";"https://preview.redd.it/b85sb4u1o1yc1.png?width=514&format=png&auto=webp&s=00f25977b3cb4f575f6647a95d6fb0afb93116a1  ";"3";"2024-05-02T19:01:06"
"Reddit's Love Story With Google Is Likely Making Them A Fuck Ton Of Money";"https://www.reddit.com/r/wallstreetbets/comments/1bfc10y/reddits_love_story_with_google_is_likely_making/";"I've done 2,5 minutes of DD so that should be enough to write an elaborate analysis of the Reddit IPO.   **TLDR:** Google and Reddit are friends, Reddit is getting 8 times Google's traffic and probably makes fuck tons more money.   I know the consensus is that Reddit is a garbage platform riddled with bots, an incompetent CEO who changes negative comments about him on the platform himself, and a bunch of power-hungry mods to keep it all under ''control'' as much as you can keep raging wildfire under control. I agree with all of this, and all of this makes me want to short this stock into oblivion as well.   I have one problem with shorting, and that's Google's and Reddit's newfound love story. As we all know in February Reddit and Google struck a deal that means Google can use all of Reddit's content tot train its AI for $60 million per year. Again, garbage deal-making on the side of Reddit, what's $60 million a year really these days? Anyway, that's not my point.   My point is what this means for Reddit traffic. Below you can see their traffic fucking skyrocketed in the past months. Coincidence? If you think Google accidentally redirects 100s of millions of users a month to Reddit, you're on an LSD trip. It's because this benefits Google (more users = more user-generated content = more data to train AI).   For Reddit, 8 times the amount of users means 8 times the amount of ad revenue. Honestly, I know they're incompetent over here, but you'd have to be very highly regarded to not make money out of that. Hell, even if they did nothing at all, they're likely to make metric fuck tons of ad revenue from this.   I know we just had a guy talk about buying/shorting stock based on web traffic (and another regard that lost money based on that tactic) but in terms of scale this is completely in its own league. Is this a buy?  Probably still shorting though. Never underestimate incompetent leadership.      https://preview.redd.it/g6qjgir8ihoc1.png?width=1067&format=png&auto=webp&s=d181a891302c0434c1c3c0a930222aa384e76cd2";"54";"2024-03-15T12:45:42"
"SentinelOne - Analysis of Organic Traffic and Google Trends: Call before Earnings?";"https://www.reddit.com/r/wallstreetbets/comments/1bdb6a6/sentinelone_analysis_of_organic_traffic_and/";"*This is the author's opinion only, not financial advice, and is intended for entertainment purposes only. The author holds a beneficial long position in SentinelOne.*  All credit for this goes to the brilliant mind that [posted this here a few days ago](https://www.reddit.com/r/wallstreetbets/comments/1bbo5vu/i_only_started_making_money_on_earnings_plays/).  I am very enthusiastic about the idea of using organic traffic as a predictor of future earnings which was posted here last week. I analyzed the web traffic with the free version of [semrush.com](https://semrush.com). The organic web traffic on [sentinelone.com](https://sentinelone.com) has increased in the last 6 months from 129 thousand to 191 thousand per day, which is about +47%.  If you plot organic traffic over the last 2 years against quarterly revenue, you get this:  https://preview.redd.it/8b4bzxffdznc1.png?width=1556&format=png&auto=webp&s=d932770dd85e86a843a01e19634cabf4e766f61e  It seems that organic traffic is picking up again. The stock does not seem to have performed well when organic traffic was down.   https://preview.redd.it/6c99nodhdznc1.png?width=2412&format=png&auto=webp&s=4f4bc07870c3182232b3d027620506af2b0f450e  Let's also include the Google Trend for the search term ""sentinelone"" (monthly average).  https://preview.redd.it/mllkh9qldznc1.png?width=1552&format=png&auto=webp&s=e386ed5bf6f8be40a80d03ce530dc63bd47bf894  &#x200B:  The Google Trend does not look very impressive on this scale, but an increasing trend can be measured by logistic regression:  https://preview.redd.it/o9har5vndznc1.png?width=1078&format=png&auto=webp&s=4cb968105a9b5ea26b2dae3b8e4d89dc0c871d77  And finally: To compare SentinelOne to its peers, a ratio that adjusts organic traffic to market cap would be nice. So I divided the organic traffic in thousands by the market capitalization in billions of USD to get nice values to compare. Using this metric, SentinelOne appears to be undervalued compared to its peers:  https://preview.redd.it/c21jq56qdznc1.png?width=1442&format=png&auto=webp&s=3783db5d078947bcc5a6c8996fc6344251f96a14  I have never bet on earnings using these parameters before, but of course I will now. After all, I am a proven regard. ";"21";"2024-03-12T23:48:45"
"$AMZN The original OG of cloud, reporting next week. Google Cloud and Azure kicking major arse. Retail Strength, plus cloud. Win for AMZN";"https://www.reddit.com/r/wallstreetbets/comments/1cffen0/amzn_the_original_og_of_cloud_reporting_next_week/";"Fed numbers are in. The consumer is not letting up. Royal Carribean showing people are loading up on self prizing, despite high interest rates on items that don't bog down too much on loan interest rates, like trips and low ticket items.   These guys have a good feel for spending. Their latest consumer spending report:  * Total card spending per household rose 0.3% year-over-year (YoY) in March, following the leap-year boosted 2.9% YoY increase in February, according to Bank of America aggregated credit debit card data. The early Easter holiday likely brought some spending from April into March. Controlling for these seasonal impacts, spending fell 0.7% month-over-month (MoM). * While spending was soft on the month, the solid labor market continues to sustain consumer momentum. March saw strong jobs growth, and this appears to be reflected in strengthening after-tax wages and salaries growth in our data – with growth at the highest level since early 2023. * Tax refunds may also provide additional support to households, with average refunds up by 5% this year through the end of March. While most consumers appear to be planning to save or pay down debt, there is a small rise in people saying they will go shopping. * We are seeing signs that easing rent inflation is providing a tailwind to renters' spending. Renters' spending growth appears to be improving most in retail categories.  [https://institute.bankofamerica.com/economic-insights/consumer-checkpoint-april-2024.html](https://institute.bankofamerica.com/economic-insights/consumer-checkpoint-april-2024.html)  Low Ticket items, relative to high, like cars and computers are guess who's specialty? Bezo's little Jungle. Yup. But guess what else is doing super cool and bueno these days? CLOUD computing, cuz all that AI compute has to live SOMEWHERE!! and it sure as hell won't be your personal computer lil bitch. It will be on the vast farms of computer these juggernauts control.   AWS has massive patterns of purchase, and consumable data, like movies and products and services. They are now in the Pharma business, Medical Insurance, Home Insurance. Talk about spreading your eggs in several baskets. Movies? socks? Tampons? whaddya need? oh and you don't need to drive anywhere for it either.   ""The report followed news last week that [job](https://www.reuters.com/markets/us/us-job-growth-beats-expectations-march-wages-increase-steadily-2024-04-05/) growth accelerated in March, with the unemployment rate slipping to 3.8% from 3.9% in February. The stubbornly higher cost of living looms large over the Nov. 5 presidential election. Still, there were some silver linings, with food prices at the supermarket unchanged and the cost of motor vehicles declining, leading to the return of goods deflation.""  [https://www.reuters.com/markets/us/us-consumer-prices-rise-more-than-expected-march-2024-04-10/](https://www.reuters.com/markets/us/us-consumer-prices-rise-more-than-expected-march-2024-04-10/)  Car prices are going down because there is less spending on large ticket items. The consumer trend is strong in certain areas where Amazon benefits. And growth of AI to supplant workers in many areas is only growing. So Amazon is growing. And crypto acceptance is growing which gives Amazon even more leverage as AWS is used Blockchain services:  [https://aws.amazon.com/blockchain/](https://aws.amazon.com/blockchain/)  [https://pharmacy.amazon.com/?ref\_=pd\_sl\_6wi9vpbepx\_e\_EDS\_dev\_c&gclid=CjwKCAjw57exBhAsEiwAaIxaZgHm-TVOFd2-kQnesFPfC-ILwJU4lcjVugGkEAmdNXPEohPVzBZjIhoCCsAQAvD\_BwE](https://pharmacy.amazon.com/?ref_=pd_sl_6wi9vpbepx_e_EDS_dev_c&gclid=CjwKCAjw57exBhAsEiwAaIxaZgHm-TVOFd2-kQnesFPfC-ILwJU4lcjVugGkEAmdNXPEohPVzBZjIhoCCsAQAvD_BwE)  Check out their travel products:  [https://www.amazon.com/travel/s?k=travel](https://www.amazon.com/travel/s?k=travel)  Royal Carribean reported a beat, cuz people are rewarding themselves on relative low ticket items where Amazon thrives.   [https://simplywall.st/stocks/us/consumer-services/nyse-rcl/royal-caribbean-cruises/news/royal-caribbean-cruises-first-quarter-2024-earnings-beats-ex](https://simplywall.st/stocks/us/consumer-services/nyse-rcl/royal-caribbean-cruises/news/royal-caribbean-cruises-first-quarter-2024-earnings-beats-ex)  More on the top dogs in cloud compute:  [15 Biggest Cloud Providers by Market Share in 2024 (yahoo.com)](https://finance.yahoo.com/news/15-biggest-cloud-providers-market-163802871.html)  https://preview.redd.it/jmx2l9qjy9xc1.jpg?width=1113&format=pjpg&auto=webp&s=84c49cfde94903731a6959a548e4b1878eb6cb41  [https://dgtlinfra.com/top-cloud-service-providers/](https://dgtlinfra.com/top-cloud-service-providers/)  ";"90";"2024-04-28T21:55:44"
"Apple in talks to let Google's Gemini power iPhone AI features, Bloomberg News says";"https://www.reddit.com/r/wallstreetbets/comments/1bhkbcv/apple_in_talks_to_let_googles_gemini_power_iphone/";"&#x200B:  [Apple in talks to let Google's Gemini power iPhone AI features, Bloomberg News says](https://www.reuters.com/technology/apple-talks-let-googles-gemini-power-iphone-ai-features-bloomberg-news-says-2024-03-18/)  If Gemini x iPhone is the coolest AI thing Apple is making, I will be super disappointed..  \---  March 18 (Reuters) - Apple [(AAPL.O), opens new tab](https://www.reuters.com/markets/companies/AAPL.O) is in talks to build Google's Gemini artificial intelligence (AI) engine into the iPhone, Bloomberg News reported on Monday, citing people familiar with the situation.Apple also recently held discussions with the Microsoft [(MSFT.O), opens new tab](https://www.reuters.com/markets/companies/MSFT.O)\-backed OpenAI and has considered using its model, the report added.Apple and Google are in active negotiations to let the iPhone maker license Gemini to power some new features coming to the phone's software this year,   Bloomberg said.Apple is preparing new capabilities as part of its upcoming iPhone iOS 18 based on its own homegrown AI models, but it is seeking a partner to power generative AI features, including functions for creating images and writing essays based on simple prompts, the report said.The two parties have not decided the terms or branding of an AI agreement or finalised how it would be implemented,   Bloomberg said, adding it was unlikely that any deal would be announced until June, when Apple plans to hold its annual Worldwide Developers Conference.Both companies have an existing deal for Google to be the default search engine on Apple's Safari web browser.Apple, Google and OpenAI did not immediately respond to a Reuters request for comment outside business hours.  Apple has been slower in rolling out generative AI, which can generate human-like responses to written prompts, than rivals Microsoft and Google, which are weaving them into products.Last month, Apple CEO Tim Cook [said](https://www.reuters.com/technology/apple-shareholders-reject-ai-disclosure-proposal-2024-02-28/) the company plans to disclose later this year more about its plans to put generative AI to use, adding that the company is investing ""significantly"" in the area.";"50";"2024-03-18T07:39:43"
"Sam leaving open Ai is Uber Bullish for Google";"https://www.reddit.com/r/wallstreetbets/comments/17yes9c/sam_leaving_open_ai_is_uber_bullish_for_google/";"&#x200B:  [Google  RN](https://preview.redd.it/qr2ajqf1y51c1.jpg?width=740&format=pjpg&auto=webp&s=02361d0d3840f36c03d205fcc144be5fcdbedb24)";"4";"2023-11-18T21:08:41"
"Calls on Google - Bard actually useful";"https://www.reddit.com/r/wallstreetbets/comments/14af1jm/calls_on_google_bard_actually_useful/";"Bard has real-time data and gives free useful summary analysis on a stocks current finances and outlook.  GPT3 gives: ""I aPoLOgiZe, bUt aS an Ai lANguaAgE mOdEL, mY reSpONes ARe GEneRatEd bAsED on Rre-eXistiNg kNowLeDge uP uNTil SePtEmbEr 2021""  I normally YOLO calls impulsively based on a Reddit headline or some random emotional reaction without doing any financial DD. But with Bard you can easily get a pretty good summary of a companies overall financial position  Google's initial chatbot release has more direct use cases than Open AIs free offering and I'm really bullish on Google's ability to further monetize its LLMs commerically via Google cloud and grow the Bard product  There's obviously tons of room for bias within Bard and this is a slippery slope, but theres def going to be really useful A.I chatbot tech for traders...wonder if theres a startup already specializing in this  https://preview.redd.it/mnv71f8v696b1.png?width=2390&format=png&auto=webp&s=3a5173888e5116ee50ea89c5f7c485a42638d22d";"58";"2023-06-16T00:09:38"
"How Google ""Exposed"" 500k Users Data and Get Away With It";"https://www.reddit.com/r/wallstreetbets/comments/1bimwip/how_google_exposed_500k_users_data_and_get_away/";"I bet all of you heard about that one Google+ scandal, with their data privacy bomb which exposed hundreds of thousands of users data.  For those who are new to Google somehow, that's the deal: in 2018, WSJ reported that Google found a ""glitch"" in Google+ earlier that year, which affecting data security. Between 2015 and March 2018, this glitch allowed outside developers access to almost 500k (!!) users personal data.  And despite discovering this issues in March 2018, Google didn't inform anybody about that to avoid regulatory issues. Simply - they didn't want ""problems with regulators which can affect their reputation"" as they said.  They were hit with may suits due to this, and finally they [resolved with $350M](https://11thestate.com/cases/alphabet-investor-settlement) the one for the investors over stock drops, so if you invested in Google you can check it I guess.  Actually, I think that Google+ was over even back then, in precovid times, they didn't have any features which weren't improved by others already and in mooore handy way. So, they didn't even have a chance to compete with any other platforms so it was kinda predetermined for them. And it's good that they are paying at least something due to this fuck up and also I think their partnership with Apple seems pretty logic at this point lol.";"36";"2024-03-19T16:26:10"
