"Post Title";"Post URL";"Content";"Post Score";"Post Date"
"Google is done for....";"https://www.reddit.com/r/wallstreetbets/comments/17gllok/google_is_done_for/";"This quarter they only made 19.7 Billion USD in net income which is abysmally low for a company it's size. Despite their AI efforts and initiatives the past 6 months Microsoft is clearly eating their lunch with bing gaining ground on Google when it comes to search and overall ad revenue.   The 9.67% down day is completely justified due to Google cloud's dreadful growth which will be Google's unbecoming. Google ONLY made 8.42 billion dollars compared to 8.64 billion dollars expectation which can result into a going concern for bankruptcy. AI is not Google's strong suit and they have overpaid for YouTube sports which will net them no profits.   Overall tiktok and Microsoft will make Google obsolete as AI advanced and tiktok becomes the new YouTube for content creators and seekers of entertainment.";"2151";"2023-10-26T04:01:24"
"What's up with Google?";"https://www.reddit.com/r/wallstreetbets/comments/1b6ubqc/whats_up_with_google/";"Google is not participating in this AI rally and we are all left wondering why. In fact it just did a double top with its 2021/22 high and  is down 15% already.     Back in 2017, some Google researchers wrote a paper that changed the game of AI forever. It was called ""Attention is all you need"" and it introduced a new way of building AI models using something called Transformers (no not that one). These models were so powerful and versatile that they could do anything from natural language processing to computer vision to music generation. Because it was open source, everyone and their mother started using Transformers for their AI projects, including Amazon, Microsoft, Meta, OpenAI, and Anthropic.      And Google? They've been playing catch-up ever since. I have always wondered why they just gave away their secret sauce for free? Can you imagine if google had a patent on the Transformer Architecture or if they had developed it first before releasing to the world?   Is this incompetence, bureaucracy or something else? Thoughts? ";"866";"2024-03-05T03:49:08"
"Google is laying off People this weekend Bullish.";"https://www.reddit.com/r/wallstreetbets/comments/1bantxk/google_is_laying_off_people_this_weekend_bullish/";"Sup Sluts,  &#x200B:  Google has sent a WARN notice to the government letting them know that on March 10th, 2024, they will be releasing a bunch of people from their 9-5 enslavement.  &#x200B:  https://preview.redd.it/ox9jkcnzkcnc1.png?width=888&format=png&auto=webp&s=4700d6193162b4b6f9ea844eb7da1f5cd92a8165  &#x200B:  [Bookmark this site](https://layoffdata.com/company/alphabet/)  &#x200B:  [For people on Mobile](https://preview.redd.it/9kobbiarfcnc1.png?width=1768&format=png&auto=webp&s=81d3ab68153ba457e4887353e25ebf84a089ad7c)  The permanent layoffs are coming from Santa Clara and San Francisco County.  Typically, layoffs are bullish, but I speculate that in this case, it is **Very** **Bullish**.  Why?  # AI.  See: [ChatGPT Passes Google Coding Interview for Level 3 Engineer With $183K Salary](https://www.pcmag.com/news/chatgpt-passes-google-coding-interview-for-level-3-engineer-with-183k-salary)  That's right.  Your favorite fucking slur word against bears when they make complete sense about overvaluation and bubbles and what-not.  I spek-ulate these positions will be replaced by AI, and the $183,000 engineering salary for these high cost of living areas will be put back in the pocket of the company.  Multiply that by 701 employees getting the boot, and that is $128,283,000 saved and put onto the market cap of the company, which isn't a lot, but we are just getting started with integration.  I know that is outrageously optimistic and there are sure to be HR staff, Graphic Artists, DEI Leaders, Janitors, and whatever other clowns that google has hired among some of the top salaries in the country.  Instead of losing manpower however, it is being replaced by a more agile technology that has a much lower operating cost.  This is what makes it different than your average layoff of a bloated employee pool.  Also,  What they did not disclose to the government is they have began laying off contractors in oregon for the Youtube Music Side of things.  The massive amount of subtitle work for every youtube song and podcast can now be automated.  I'm marking it as a discussion not DD since I feel it's a fairly simple strategy.  Also, if you work for google in these counties, sorry you had to hear it from me instead of a Sunday morning text saying don't come to work anymore.  TL:DR: Google Calls";"2008";"2024-03-09T19:01:20"
"GOOG: The Guy Who Killed Yahoo Search is Now Running Google's";"https://www.reddit.com/r/wallstreetbets/comments/1cbrwwz/goog_the_guy_who_killed_yahoo_search_is_now/";"So I was digging around and found out that Prabhakar Raghavan, the head of Google Search, used to be the head of search at Yahoo from 2005 to 2012. And let me tell you, it's not a pretty story. During his time at Yahoo, the company's search market share PLUMMETED from 30.4% to 13.4%. Yeah, you read that right - it was a FREE FALL. And it's not like he was just a bystander, he was in charge of research and development for Yahoo's search and ads products. But wait, it gets better. Under his leadership, Yahoo's search market share DECLINED FOR 9 CONSECUTIVE MONTHS. And to top it all off, Yahoo had its LARGEST LAYOFFS IN CORPORATE HISTORY at the time, cutting nearly 2,000 jobs. Is this a risk to GOOG long-term healthy growth? Have they started prioritizing short-term ad revenue over user experience, flooding search results with spam and ads to inflate earnings? Are we seeing a repeat of Yahoo's mistakes? ";"3202";"2024-04-24T09:04:16"
"Google likely to layoff 30,000 employees post new AI innovation";"https://www.reddit.com/r/wallstreetbets/comments/18twunm/google_likely_to_layoff_30000_employees_post_new/";"https://www.cnbctv18.com/education/google-likely-to-layoff-30000-employees-post-new-ai-innovation-18662731.htm  “Google is actively engaged in advancing its AI model, but recent indications suggest that the tech giant is not just focusing on AI development for external applications but is also contemplating a significant shift in its operational structure.”  Title of the article says “layoff” but content says “reorganizing”.  Do my fellow smooth brains think that $GOOG might be the stock of 2024 with their focus on operational efficiency?";"2152";"2023-12-29T21:40:04"
"You missed META, NFLX, GOOGL? Try AAPL";"https://www.reddit.com/r/wallstreetbets/comments/1bqq2iz/you_missed_meta_nflx_googl_try_aapl/";"I think AAPL is an obvious play. It hasn't participated in this 2024 rally at all and is due for a catch-up play. Two main reasons why AAPL has been lagging: slowing growth (mainly China) and lack of AI hype. The slowing growth is priced into the stock. Earnings expectations are already low for AAPL.    AAPL reminds me of GOOGL this year when it was in similar situation of dumpster fire but then broke out after it finally worked out Gemini. AAPL already told you that it's going to make a push to AI, which should mean multiple expansion for AAPL stock. My guess is that in June we'll see Siri being totally revamped and actually be useful. Don't get me wrong this June WWDC event needs to be successful or this stock will stay dumpster fire. We need to see some sort of hype and the market needs to be convinced that that the next iphone will be a must-have due its new AI features. If there's anyone who can market the shit out of anything, it's AAPL.  The whole kitchen sink was thrown at AAPL recently. You have dissapointing product launch of its Vision Pro. You have the news about negative China sales. You have this big DOJ case come out of no where. You had an analyst downgrade yesterday. And even with all of that, it didn't make a new low from March 6th. Unless there's an unexpected market-wide correction, I can't see AAPL going lower this year.  This whole market recently has been a rotation trade. That is why the market has gone up even without AAPL and now without NVDA. The market has been broadening. It will continue to find laggards and re-allocate money from hot areas. AAPL is that obvious laggard right now and it needs to eventually participate for the market to continue signficiantly higher.  TLDR: June $175 calls";"423";"2024-03-29T15:03:19"
"Forbes: Nvidia, Google And Microsoft Are Betting Billions On Biotech’s AI Future";"https://www.reddit.com/r/wallstreetbets/comments/1bh9eol/forbes_nvidia_google_and_microsoft_are_betting/";"Forbes just posted this video today going over Nvidia's future in the Biotech space. I think its very interesting where a lot of the investments Nvidia is making goes.  [https://www.youtube.com/watch?v=Xzw7TXdXYtk](https://www.youtube.com/watch?v=Xzw7TXdXYtk)";"595";"2024-03-17T22:37:02"
"2024 is google time";"https://www.reddit.com/r/wallstreetbets/comments/191iefv/2024_is_google_time/";"Disclaimer: This is not financial advice  Google (GOOG) is one of the most dominant and innovative companies in the world, with a market cap of over $1.7 trillion and a diverse portfolio of products and services. In this post, I will highlight some of the reasons why I am very bullish on Google and why I think it is a great long-term investment.  AI Drug Discovery  Isomorphic Labs,under Alphabet deepmind, has been working on a new AI drug development project with Eli Lilly and Novartis, which is worth $3 billion.  It is more than open ai last year revenue. It just insane. The AI profitability is not on chatbot but AI industry revolution.  Google’s AI drug development project with Eli Lilly and Novartis is a promising venture that could revolutionize the pharmaceutical industry. While the project is still in its early stages, it has the potential to develop new treatments for diseases such as cancer and Alzheimer’s. Investors should keep an eye on this project as it progresses.     Waymo  Waymo is Google's self-driving car subsidiary and one of the most advanced and ambitious projects in the autonomous vehicle industry. Waymo has been operating commercial robotaxi services in Phoenix, Arizona and San Francisco, California, with plans to expand to Los Angeles and Austin, Texas.   Waymo has a competitive edge over its rivals, such as Tesla, Uber, and Lyft, in terms of technology, data, and regulation. Waymo has logged over 20 million miles of real-world driving and over 20 billion miles of simulation, giving it a huge amount of data to train and improve its AI. Waymo also has a full-stack approach, developing its own hardware and software, and using fully electric vehicles powered by renewable energy. Waymo is also one of the few companies that have obtained regulatory approval to operate without safety drivers in the vehicle, making it the first company to offer a truly driverless service to the public.  Waymo has a huge potential to disrupt the transportation industry and create new revenue streams for Google. Waymo can offer a cheaper, safer, and more convenient alternative to traditional car ownership, ride-hailing, and public transit. Waymo can also leverage its technology to enter other markets, such as trucking, delivery, and logistics. Waymo is estimated to be worth over billions and could generate over $10 billion in annual revenue by 2030.   Gemini  Gemini is Google's newest and most ambitious AI project, aiming to create a general-purpose AI system that can understand and interact with any type of information. Gemini is built from the ground up for multimodality, meaning it can seamlessly reason across text, images, video, audio, and code. Gemini can also generate creative and innovative content, such as poems, stories, code, essays, songs, and more.   Gemini is a game-changer for Google and the world, as it can enable new possibilities and applications that were previously unimaginable. Gemini can enhance Google's existing products and services, such as Search, YouTube, Gmail, Maps, and more, by providing more accurate, relevant, and personalized results. Gemini can also create new products and services, such as education, entertainment, health, and more, by providing tailored and engaging experiences. Gemini can also empower users and developers, by allowing them to access, manipulate, and create any type of information with natural language and voice commands.   Conclusion  Google is a powerhouse of innovation and growth, with a strong track record of delivering value to its shareholders. Google has a clear vision and strategy to leverage its AI capabilities to create new drugs, new modes of transportation, and new ways of interacting with information. Google is well-positioned to capitalize on the massive opportunities and challenges that lie ahead in the 21st century. Google is not just a search engine, it is a global leader in AI and a pioneer in the future of humanity.   I am very bullish on Google and I think it is a must-have stock for any long-term investor. Google to the moon! 🚀🚀🚀.  Tldr 30-day 160 call  Their earning will smash it ";"73";"2024-01-08T11:41:29"
"Apple Is in Talks to Let Google’s Gemini Power iPhone Generative AI Features";"https://www.reddit.com/r/wallstreetbets/comments/1bhjpe2/apple_is_in_talks_to_let_googles_gemini_power/";" Apple is in talks to build Google's Gemini artificial intelligence engine into the iPhone .Apple also recently held discussions with OpenAI and has considered using its model. Apple and Google are in active negotiations to let the iPhone maker license Gemini, Google's set of generative AI models, to power some new features coming to the phone's software this year, Bloomberg said. The two parties have not decided the terms or branding of an AI agreement or finalized how it would be implemented. It is unlikely that any deal would be announced until June, when Apple plans to hold its annual Worldwide Developers Conference.  SOURCE:  [https://www.bloomberg.com/news/articles/2024-03-18/apple-in-talks-to-license-google-gemini-for-iphone-ios-18-generative-ai-tools](https://www.bloomberg.com/news/articles/2024-03-18/apple-in-talks-to-license-google-gemini-for-iphone-ios-18-generative-ai-tools)";"413";"2024-03-18T06:57:32"
"Google Loses Antitrust Suit";"https://www.reddit.com/r/wallstreetbets/comments/18gbky0/google_loses_antitrust_suit/";"Federal jury says Google’s app store violated antitrust law with their fees on in app purchases and monopolistic app store practices. I'm sure this isn't the end of the fight but it sets strong precedent. Puts on Google and Apple.  https://www.cnn.com/2023/12/11/tech/google-app-store-epic-games";"148";"2023-12-12T03:43:19"
