"Post Title";"Post URL";"Content";"Post Score";"Post Date"
"GRND: Gamble on the Gays";"https://www.reddit.com/r/wallstreetbets/comments/14ebqzv/grnd_gamble_on_the_gays/";"   Alright WSB. So I (for research purposes) decided to download Grindr and immediately got like 15x as many matches as I did on Tinder. This made me realize that Grindr is probably making HELLA tendies from these insanely active users.   It turns out I was right, and GRND is set up for insane growth and $$ in the future.  Now I will make this shit short because you all have an attention span shorter than a cocaine crazed monkey. (If you want more information, here's a ton of info I collected about the company[ https://docs.google.com/document/d/14PLrTHYfY3Hz\_udhv2DrDCgGNqeAkdJk7HbvjLLTUh4/edit?usp=sharing](https://docs.google.com/document/d/14PLrTHYfY3Hz_udhv2DrDCgGNqeAkdJk7HbvjLLTUh4/edit?usp=sharing)) \*WARNING, there are no crayon pictures -- so if you can't read don't click the link     **Thesis:**  * Americans are lonelier, hornier, and gayer than ever, and who will benefit from that? Grindr! * GRND has a large and growing monetizable user base * Solid fundamentals with rapidly increasing Revenue and EBITDA * Low IV and Beta * 94.8% of shares are not publicly traded  For those of you who wanna actually “invest” (or atleast buy Leaps), I’ll give you the long-term play first. For the rest of you who just wanna YOLO on Weeklies, the short-term play is further below.   **Long-Term:**  Loneliness rates in America are rising at a rapid pace, with each subsequent generation more lonely than the last  https://preview.redd.it/g13xnibdh67b1.png?width=1000&format=png&auto=webp&s=4509902f369114f252a1169c5dc24d551ce5e337  This is set to continue as technology makes us more disconnected. This sounds sad, but guess what we can do from this? GET FUCKING RICH!  Because of this, online dating apps are increasing insanely fast. A lot of lonely people (especially redditors), will pay insane amounts of money for the chance to date or have sex.  In addition to this, younger generations are MUCH more likely to identify as LGBT+  https://preview.redd.it/3v1rg9wdh67b1.png?width=1920&format=png&auto=webp&s=d241bb36f92bb59658785f376280b164228002cb  This sets up GRND in a PERFECT position. Growing loneliness and growing gayness. And they have capitalized on this, with now over 13 million monthly active users  And luckily for Grindr, 90% of their revenue comes from subscriptions. This means any potential economic slowdown won't impact them nearly as much as their competitors who rely more on ads.  In addition to this, the fundamentals are solid  1. The company has positive FCF and rapidly growing EBITDA meaning GRND likely won’t need to raise more capital 2. EBITDA is growing MUCH faster than revenue - meaning this company will be a cash flow machine! 3. Revenue is still growing fast and is projected to continue like that for some time 4. Their Average Revenue Per User (ARPU) is almost 2x as high as their competitors such as Bumble and 1.5x higher than Match Group 5. Their Cost of Revenue is decreasing over time while their Gross Profit is growing at 35%+ 6. Their assets are growing faster than their liabilities  These numbers are crazy good, especially considering these are Y/Y numbers that were likely inflated by COVID and lonely people in lockdown with a ton of $$ and time to spend.  Now I spent 10 hours digging deeper into the filings and found a fuck ton of good numbers - but that is kinda boring so if u have questions and wanna see info just comment or go to the google doc pasted above.  For those with gambling addictions, here is the short term play     **Short Term:**  GRND’s public float is ONLY 5.2% of outstanding shares, with the rest being held by insiders and institutions.  https://preview.redd.it/ygz92g2fh67b1.png?width=407&format=png&auto=webp&s=d64003a6c8cb125939fd1059995efc6fcaccc4f9  What this means is any buying pressure has a MASSIVE impact on share prices. Like I am talking about a bigger impact than when your wife’s boyfriend pounds her.  In addition, 72.5% of the shares CAN’T even be sold!  https://preview.redd.it/j3f2pdmfh67b1.png?width=1437&format=png&auto=webp&s=54e0c58190d2e6020206c5a90c6c09625753ec67  What makes this play EVEN better is the fact that GRND has a Beta of 0.13 (basically 9x less volatile than the s&p). You might be thinking “BORING”, but you are wrong. Options are now incredibly cheap!  This is essentially the best time in history to buy call options cause of the low IV. Basically with any positive news or catalyst, this stock is set to EXPLODE.  Positions: 400 shares & 3 7/21 $5 C  TLDR:     https://preview.redd.it/7lbeeqkgh67b1.png?width=1290&format=png&auto=webp&s=49f011acb72a558d86b0e867931fec9a63a7a1f1";"3249";"2023-06-20T15:52:43"
"Dr. Bojan Tunguz Quits Nvidia and Destroys the Chip Competition On His Way Out - Money is Just a transient commodity turning into GPUs";"https://www.reddit.com/r/wallstreetbets/comments/1c60jqb/dr_bojan_tunguz_quits_nvidia_and_destroys_the/";"I mean this isn't a DD [but he kind of dropped some bombs here on his way out](https://twitter.com/tunguz/status/1780367503941619854). I can't think of a person leaving a company and just decimating the competition on the way out while blessing his former employer with the highest praise.  He's saying there is no chance in hell for others to catch up and not anytime soon.  I don't know if this is news but it should be. He's effectively saying AMD, Intel and whoever the hell else is thinking about their own chips just forget about it.  Here is why I believe the same thing. Claude Opus which is almost comparable to GPT 4 allows you to have 40 messages a day. That is just dire and completely inadequate for any real workload. And the responses come back in moments compared to GPT.  GPT5 is almost here and I don't think the world is ready for what that is going to be. Sora is already insanely ridiculous with Google's AI Chief, Demis Hassabis, and I quote, "" it could be difficult for Google to draw level with OpenAI's Sora."" And that's ALL GPU's folks.  If one major player or sovereign nation state gives up on the pursuit of AGI they will be behind in a severely detrimental manner.  https://preview.redd.it/9in7zafcsyuc1.png?width=898&format=png&auto=webp&s=e309db0adf4c947a7ddeab221d5de11d676f3063  https://preview.redd.it/owo41bfcsyuc1.png?width=897&format=png&auto=webp&s=303b1bfafdc79a1937a78836546ff0ff8082e30f  https://preview.redd.it/qbwf5afcsyuc1.png?width=886&format=png&auto=webp&s=aa5d12e47889ac43ebef7ba7c4e4bd9fb11cc42e";"317";"2024-04-17T06:09:27"
"My dad says that Netflix will go down tomorrow after earnings";"https://www.reddit.com/r/wallstreetbets/comments/1c6u8xz/my_dad_says_that_netflix_will_go_down_tomorrow/";"I asked my dad today about his short term view on Netflix stock. My dad, who has decided to hold Rivian shares until 0, has informed me that he thinks Netflix stock will \*\*\*\* the bed on earnings. I am so sorry to all Netflix bears, my dad will run your brokerage accounts dry.   He says that its 'because he saw the financials' while working on a accounting software deliverable for SAP with Netflix as its customer. But, when I pressed for more specifics, he refused to elaborate.   Betting against Netflix stock before earnings is no longer safe. My dad buys terrible companies regularly, and gets it wrong about the Mag 7. If you are betting against Netflix stock, your funds are not SAFU.   On another note, Evercore ISI has also released a pessimistic outlook on Netflix being unable to exceed investor expectations for core subscriber count. This investor bank rated one star on Google Reviews has regularly delivered inaccurate stock recommendations to me. The only stock that it has accurately upgraded and downgraded consistently is William-Sonoma.  In conclusion, it will not be safe to bet against Netflix stock on Thursday.    ";"1845";"2024-04-18T06:11:00"
"Which stock are you going to ride or die with at least for the next 5 years?";"https://www.reddit.com/r/wallstreetbets/comments/1bmdfbl/which_stock_are_you_going_to_ride_or_die_with_at/";"";"1027";"2024-03-24T06:40:13"
"Zuckerberg to buy $9 billion of GPUs";"https://www.reddit.com/r/wallstreetbets/comments/19a1mgu/zuckerberg_to_buy_9_billion_of_gpus/";">Meta is investing billions of dollars in Nvidia's H100 AI chips to build a massive compute infrastructure by 2024, aiming to create artificial general intelligence (AGI). CEO Mark Zuckerberg announced the purchase of 350,000 H100 cards and over 600,000 equivalent GPUs. Meta's expenditure, estimated at nearly $9 billion, is part of its $94-$99 billion 2024 budget for AI, as it competes with OpenAI and Google's DeepMind for AGI advancements.   This is roughly equivalent to an entire quarter of production from Nvidia, to one company.";"850";"2024-01-18T22:37:29"
"NVDA is Worth $1000+ This Year - AI Will Be The Largest Wealth Transfer In The History of The World - Sam Altman Wasn't Joking...";"https://www.reddit.com/r/wallstreetbets/comments/1aqf0zb/nvda_is_worth_1000_this_year_ai_will_be_the/";"**UPDATE2: Open AI Release Massive Update SORA Text/Speech to Video**   [https://www.theverge.com/2024/2/15/24074151/openai-sora-text-to-video-ai](https://www.theverge.com/2024/2/15/24074151/openai-sora-text-to-video-ai)  [https://www.youtube.com/watch?v=nEuEMwU45Hs](https://www.youtube.com/watch?v=nEuEMwU45Hs)  **UPDATE: Sam Altman Tells the World (literally** [The World Governments Summit](https://youtu.be/JVatgo0TJIw?si=3-Jkw9F3ZlkilulX&t=61)**) that** [GPT-5 Is Going To Be a Big Deal](https://youtu.be/-Mca6eN81Is?si=Ym59zLD2VZ2yefZU) **- GPT-5 Will Be Smarter Across The Board - Serious AGI in 5 - 10 Years.**  **THIS IS WAR - And Nvidia is the United States Military Industrial Complex, The Mongol Empire, and Roma combined.**  AI will be as large as the internet and then it will surpass it. AI is the internet plus the ability to reason and analyze anything you give it in fractions of a second. A new unequivocal boomstick to whomever wants to use it.  The true winners will be those startups in fields such as robotics, healthcare, pharmaceuticals, space-aeronautics, aviation, protein synthesis, new materials and so, so much more who will use AI in new and exciting ways.  Boston dynamics, set to boom. Self-driving robotaxis, set to boom. Flying taxis, set to boom. Job replacement/automation for legacy industry jobs white collar, set to boom. Personal AI agents for your individual workloads, booming. Healthcare change as we know it (doctors won't like this but too bad), set to boom.  The amount of industry that is set to shift and mutate and emerge from AI in the next 3 - 5 years will be astonishing.  I can tell you, standing on principal, that OpenAI's next release will be so game changing that nobody will deny where AI is heading. There is not a rock you can hide under to be so oblivious as to not see where this is going.  The reason why I bring up the next iteration of ChatGPT, GPT5, is because they are initiators of this phenomenon. Other, such as Google (and others) are furiously trying to catch up but as of today the 'MOAT' may be upon us.  The reason to believe that one may catch up (or try like hell to) is from the amount of compute power from GPU's it takes to train an ungodly amount of data. Trillions of data points. Billions (soon to be Trillions) of parameters all simulating that of the synaptic neuron connections in which the human brain functions that in turn gives us the spark of life and consciousness. Make no mistake, these guys are living out a present day Manhattan project.  These people are trying to build consciousness agency with the all the world's information as a reference document at it's finger tips. Today.  And guess what. The only way these guys can build that thing - That AGI/ASI/GAI reality - Is through Nvidia.  These guys believe and have tested that if you throw MORE compute at the problem it actually GAINS function. More compute equals more consciousness. That's what these people believe and they're attempting it.  Here, let me show you what I mean. What the graph below shows is that over time the amount of data and parameters that are being used to train an AI model. I implore you to watch this video as it is a great easy to understand educational video into what the hell is going on with all of this AI stuff. It's a little technical but very informative and there are varying opinions. I pulled out the very best part in relation to Nvidia here. [AI: Grappling with a New Kind of Intelligence](https://youtu.be/EGDG3hgPNp8?si=L71CUbmqho3jhKEh&t=3768)  https://preview.redd.it/vk5twc041hic1.png?width=1318&format=png&auto=webp&s=a3d2bdf42cf25e1c04e940b2f61d0219871f2334  It's SO RIDICULOUS that you wouldn't be able to continue to see the beginning so they have to use a log plot chart. And as you see we are heading into Trillions of parameters. For reference GPT-4 was trained on roughly 200 billion parameters.  https://preview.redd.it/6cq17n5i1hic1.png?width=1327&format=png&auto=webp&s=830334aa7cdaddfa10d7f6512d10025f136076ed  It is estimated GPT-5 will be trained with 2-5 trillion parameters.  Sam Altman was dead ass serious when he is inquiring about obtaining $7 trillion for chip development. They believe that with enough compute they can create GOD.  So what's the response from Google, Meta and others. Well, they're forming ""AI """"Alliances"""""". Along with that they are going to and buying from the largest AI arms dealer on earth: Nvidia.  Nvidia is a common day AI Industrial Complex War machine.  **Sovereign AI with AI Foundries**  It's not just companies that are looking to compete it's also entire Nation States. Remember, when Italy banned GPT. Well, it turns out, countries don't want the United States building and implementing their AI into other country's culture and way of life.  So as of today, you have a battle of not just corporate America but entire countries looking to buy the bullets, tanks and missiles needed for this AI fight. Nvidia sells the absolute best bullets, the best guns, the best ammo one needs to attempt to create their own AI epicenters.  And it's so important that it is a national security risk to not just us the United States but to be a nation and not have the capability of AI.  Remember the leak about Q\* and a certain encryption being undone. You don't think heads of State where listening to that. Whether it was true or not it is now an imperative that you get with AI or get left behind. That goes just as much for a nation as it does for you as an individual.  When asked about the risk of losing out sales to China on Nvidia's last earnings call Jensen Huang clearly stated he was not worried about it because literally nations are coming online to build AI foundries.  **Nvidia's Numbers and The Power Of Compounding**  The power of compounding and why I think there share price is where it is today and has so much more room to grow. Let me ask you a question but first let me say that AWS's annual revenues are at \~$80/Y Billion. How long do you think with Nvidia's revenues of \~$18/Q Billion to reach or eclipse AWS at a 250% growth rate?  15 years? 10 Years? 5 years? Answer: 1.19 years. Ok let's not be ridiculous perhaps it's 200% instead.  5 years? Nope. 1.35 years.  Let's say they have a bad quarter and Italy doesn't pay up. 150%  5 years right? Nope. 1.62 years.  Come on they can't keep this up. 100%.  has to be 5 years this time. Nope. 2.15 years.  100% growth/2.15 years to 250% growth/1.19 years to reach 80 billion in annual revenues.  They're growth last year was 281%.  So wait, I wasn't being fair. I used $80 billion for AWS while their revenues last year where $88 Billion and Nvidia's last years 4 quarters where \~$33 Billion.  Here are those growth numbers it would take Nvidia to reach $88 billion.  At 279% =  0.73 years  At 250% = 0.78 years  At 200% = 0.89 years  at 100% = 1.41 years  Folks. That's JUST the data center. They are poised to surpass AWS, Azure and Google Cloud in about .73 to 1.5 years. Yes, you heard that right, your daddy's cloud company is about to be overtaken by your son's gaming GPU company.  When people say Nvidia is undervalued. This is what they are talking about. This is a P/S story not a P/E story.  [https:\/\/ycharts.com\/indicators\/nvidia\_corp\_nvda\_data\_center\_revenue\_quarterly](https://preview.redd.it/xa46amh0dhic1.png?width=1450&format=png&auto=webp&s=6e9116e55235991b1113713b5b7cd7d30c58d515)  This isn't a stonk price. This is just Nvidia executing ferociously.  |**Date**|**Value**| |:-|:-| |October 29, 2023|14.51B| |July 31, 2023|10.32B| |April 30, 2023|4.284B| |January 29, 2023|3.616B|  This isn't Y2k and the AI ""dot-com"" bubble. **This is a reckoning.** This is the largest transfer of wealth the world has ever seen.  Look at the graph. Look at the growth. That's all before the next iteration of GPT-5 has even been announced.  I will tell you personally. The things that will be built with GPT-5 will truly be mind blowing. That Jetson cartoon some of you may have watched as a kid will finally be a reality coming to you soon in 2024/2025/2026.  The foundation of work being laid now is only the beginning. There will be winners and there will be loser but as of today:  **$NVDA** is fucking **KING**  For those of you who still just don't believe or are thinking this has to end sometimes. Or fucking Cramer who keeps saying be careful and take some money out and on and on. Think about this.  It costs you to just open an enterprise Nvidia data center account \~$50k via a ""limited time offer""  >DATA CENTER NEWS. Subscribe. Get the Latest from NVIDIA on Data Center. LIMITED *TIME OFFER: $49,900 ON NVIDIA DGX STATION*. For a limited time only, purchase a ...  To train a model a major LLM could cost millions who knows maybe for the largest model runs BILLIONS.  Everyone is using them from Nation States to AWS, Microsoft, Meta, Google, X. Everybody is using them.  I get it. The price of the stock being so high and the valuation makes you pause. The price is purely psychological especially when they are hitting so many data points regarding revenues. The stock will split and rightly so (perhaps next year) but make not mistake this company is firing on ALL cylinders. The are executing S Tier. Fucking Max 9000 MX9+ Tier. Some god level tier ok.  There will be shit money that hits this quarter with all the puts and calls. The stock may rescind this quarter who knows. All i'm saying is you have the opportunity to buy into one of the most prolific tech companies the world has ever known. You may not think of them as the Apples or the Amazons or the Microsoft's or the Google's and that's ok. Just know that they are 1000% percent legit and AI has just gotten started.  Position: 33% of my portfolio. Another 33% in$Arm. Why? Because What trains on Nvidia will ultimately run/inference on ARM. And 33% Microsoft (OAI light).  If OpenAI came out today public I would have %50 of my portfolio in OAI i'll tell you that.  This is something you should have and should own in your portfolio. It's up to you to decide how much. When you can pay your children's college. When you can finally get that downpayment on that dream house. When you can buy that dream car you've always wanted. Feel free to drop a thank you.  TLDR: BUY NVIDIA, SMCI and ARM. This is not financial advice. The contents of this advertisement where paid by the following... ARM (:)";"2339";"2024-02-14T06:10:49"
"Intel DD - Underbought and Oversold: Why You Should Be Investing In The AI Revolution's Cheapest Stock";"https://www.reddit.com/r/wallstreetbets/comments/1c2ff3r/intel_dd_underbought_and_oversold_why_you_should/";"It's 2024 and Intel has not exactly performed admirably. While its competitors - AMD and NVIDA - have hit the moon and then some, Intel is still struggling along at around the price that it was prior to anyone knowing what ChatGPT was. If anyone had the massive foresight to invest in a chipmaker on the eve of the explosion in AI hype, they'd have been wrong to choose Intel. Problematic!  There are reasons for this, of course. Intel has not come out with a cutting-edge product - Nvidia's H100 has blown anything Intel's been able to offer out of the water. Intel has a notoriously dysfunctional corporate structure. Intel has been, since way before this subreddit existed, known for being a limp stock that trading sideways. China has been making noises about phasing out foreign chips. All these factors have prevented Intel from achieving the sort of green candlesticks that AMD and Nvidia sprouted as the implications of AI - and the vital role GPUs would play in powering it - became clear.  In spite of all this, I think Intel is a strong buy right now. Why?  For one, it's at a price we haven't seen in nearly a year. There's been a string of bad - but not structurally undermining - news coming out about the company recently, similar in form to the Gemini debacle that brought Google down to 133 a month ago. Google is now at 160, because AI is a hell of a thing to have in your column. The same dynamic is going to push Intel's price up. If you want that in technical analytic terms - RSI is below 30. Buy.  Intel is also catching up. [It's releasing a chip](https://finance.yahoo.com/news/intels-artificial-intelligence-ai-chip-085500073.html) that can beat the H100! That's not the whole story, of course - there's rumors that NVDA's latest Blackwell offering will be better than Intel's when they release it later this year. But demand for AI and the chips that power it is only spiking. We're even starting to see LLMs that can operate locally at the consumer level, which requires a lot of hardware. Nvidia's already selling out for years in advance - people aren't going to be able to get their hands on the most cutting-edge chips for a long, long time. And so Intel is going to end up with a shitload of demand in its lap.   There's also the national security angle. Intel is the only major domestic chipmaker, and America has a considerable interest in ensuring that its domestic chipmaking capabilities are at least on par with other countries. Congress has already passed billions of dollars to domestic chipmaking efforts, and Intel will be a major beneficiary as it continues to dispense cash.   Their earnings call is on 4/25, and so [here's my 4/26 call spread](https://imgur.com/a/kNWdyfT). I expect these to pick up a lot of IV as we get closer to 4/25. We're going to make a lot of money together, regards.";"648";"2024-04-12T19:45:10"
"The Market is No Longer Rational - Here are Tomorrow's Top 4 Picks (plus 2 bonus picks)";"https://www.reddit.com/r/wallstreetbets/comments/1cce4gt/the_market_is_no_longer_rational_here_are/";"**Microsoft** - They make money and do AI things so it will drop **-20%**  * Bull Case - They lose a lot of money * Bear Case - They make a lot of money and they're involved in AI  **Google (forgot)** - They make money and AI so it will drop **-18.75%**  * Bull Case - They lose money and search market share shrinks heavily. They have Googler's streak through Pinchia's office for a group sit-in regarding government contracts to protect America * Bear Case - They make a lot of money, increase search and some Googler's streak through the main lobby protesting DEI budget cuts. Talks about AI.  **Roku** - They lose 30% of subscribers so it will moon **+15%**  * Bull Case - They lose a bunch of subscribers * Bear Case - They gain a lot of subscribers and money but then say they won't report subscriber numbers. May talk about AI  **Royal Caribbean** - Moons **+15%** because only 1 person jumped off the ship  * Bull Case - Everyone on the last cruise out of Mexico got Norovirus and turkey trots but it's being contained. Has no exposure to AI. * Bear Case - Makes a lot of money and they are full on capacity. Probably has AI on that boat.  **SNAP** - Moons **+20%** because they have 1 teenager left on the platform sharing nudes  * Bull Case - Xi Xing Ping Allows Snap China because TikTok just got banned and perhaps will be 2 teenagers on the platform. They don't know what AI is and don't mention it on their call. * Bear Case - Reports surprise earnings and more than 2 teenagers still on the platform. Talks about AI.  **Bonus (for pro members)**  Atlassian - Nobody using it so must moon **+30%**  Dexcom - Curing people's diabetes and giving people better diabetic management - Loses **-20%** AH";"4582";"2024-04-25T02:20:49"
"What Are Your Moves Tomorrow, May 8, 2024";"https://www.reddit.com/r/wallstreetbets/comments/1cml3bs/what_are_your_moves_tomorrow_may_8_2024/";"[View Post](https://new.reddit.com/r/wallstreetbets/post-viewer/1cml3bs)";"277";"2024-05-07T22:00:29"
"Is AI a zero sum game?";"https://www.reddit.com/r/wallstreetbets/comments/1basbnl/is_ai_a_zero_sum_game/";"AI is causing huge increases in value for Nvidia, google, + thousands of AI startups. But, I have yet pay directly for ai. I understand that ai will make businesses a lot more efficient, this may create huge layoffs and make ai company owners super rich.   But where will those who lose their jobs get their income from? Who will buy ai products if they are unemployed?   Remember when Henry Ford increased his factory workers wages so that they could afford to buy cars?  A society needs jobs, and money should circulate not accumulate, there is a huge risk in ai that has not need addressed.";"135";"2024-03-09T22:10:47"
